{
	"$schema": "https://json-schema.org/draft/2019-09/schema",
	"properties": {
		"$schema": {
			"type": "string"
		},
		"additionalProperties": {
			"type": "boolean"
		},
		"name": {
			"type": "string"
		},
		"description": {
			"type": "string"
		},
		"primaryKey": {
			"type": "array"
		},
		"columns": {
			"$ref": "#/definitions/columns"
		}
	},
	"additionalProperties": false,
	"definitions": {
		"columns": {
			"type": "object",
			"additionalProperties": {
				"$ref": "#/definitions/column"
			}
		},
		"column": {
			"type": "object",
			"required": ["type"],
			"properties": {
				"type": {
					"type": "string",
					"enum": ["string", "number", "datetime", "decimal", "guid"]
				},
				"format": {
					"type": "string",
					"enum": ["amount", "price", "quantity", "measure"]
				},
				"size": {
					"type": "number"
				},
				"default": {
					"type": "string"
				},
				"values": {
					"$ref": "#/definitions/validValues"
				},
				"editSize": {
					"type": "number"
				}
			},
			"additionalProperties": false
		},
		"validValues": {
			"type": "object",
			"additionalProperties": {
				"type": "string"
			}
		}
	}
}
